{
  "schema": "dl-controlled-interruption-recovery-observation/v1",
  "observation_id": "dl-interruption-minimal",
  "manifest_sha256": "1111111111111111111111111111111111111111111111111111111111111111",
  "run_id": "dl-run-0001",
  "study_id": "dl-study-0001",
  "case_sha256": "2222222222222222222222222222222222222222222222222222222222222222",
  "observed_at": "2026-08-24T08:00:00Z",
  "evidence_scope": "real_framework_hardware_controlled_child_process_interruption_recovery_engineering",
  "status": "completed",
  "runner": {
    "name": "pytorch-gpu-controlled-interruption-recovery-runner",
    "version": "0.1.0",
    "source_sha256": "3333333333333333333333333333333333333333333333333333333333333333",
    "checkpoint_implementation": {
      "name": "pytorch-gpu-checkpoint-recovery-runner",
      "version": "0.1.0",
      "source_sha256": "4444444444444444444444444444444444444444444444444444444444444444"
    }
  },
  "fixture": {
    "fixture_sha256": "5555555555555555555555555555555555555555555555555555555555555555",
    "seed": 7,
    "samples": 16,
    "requested_steps": 4,
    "checkpoint_step": 2
  },
  "execution": {
    "mode": "gpu_fixture",
    "os": "windows",
    "architecture": "AMD64",
    "python_version": "3.12.13",
    "framework": {
      "name": "pytorch",
      "version": "2.12.1+cu130",
      "backend": "cuda",
      "backend_version": "13.0",
      "determinism": "strict"
    },
    "hardware": {
      "device_model": "NVIDIA GeForce RTX 4060 Laptop GPU",
      "device_count": 1,
      "memory_bytes_per_device": 8585216000,
      "compute_capability": "8.9"
    }
  },
  "processes": [
    {
      "role": "interruptible_source",
      "completed_steps": 2,
      "duration_seconds": 0.1,
      "peak_memory_bytes": 1024
    },
    {
      "role": "resume",
      "completed_steps": 2,
      "duration_seconds": 0.1,
      "peak_memory_bytes": 1024
    },
    {
      "role": "uninterrupted_control",
      "completed_steps": 4,
      "duration_seconds": 0.2,
      "peak_memory_bytes": 1024
    }
  ],
  "interruption": {
    "kind": "parent_requested_owned_child_termination",
    "checkpoint_confirmed_before_request": true,
    "spawn_identity_verified": true,
    "termination_method": "popen_terminate",
    "source_exit_observed": true,
    "source_returncode_nonzero": true
  },
  "checkpoint": {
    "locator": "artifact://dl-run-0001/controlled-interruption-checkpoint-0002.pt",
    "content_sha256": "6666666666666666666666666666666666666666666666666666666666666666",
    "size_bytes": 4096,
    "model_state_sha256": "7777777777777777777777777777777777777777777777777777777777777777",
    "optimizer_state_sha256": "8888888888888888888888888888888888888888888888888888888888888888",
    "scheduler_state_sha256": "9999999999999999999999999999999999999999999999999999999999999999",
    "completed_steps": 2,
    "store_kind": "caller_managed_local_directory",
    "repository_persisted": false,
    "lifecycle": {
      "temporary_payload_verified": true,
      "atomic_replacement_completed": true,
      "authoritative_payload_verified": true
    }
  },
  "equivalence": {
    "resumed_model_state_sha256": "aaaaaaaaaaaaaaaaaaaaaaaaaaaaaaaaaaaaaaaaaaaaaaaaaaaaaaaaaaaaaaaa",
    "control_model_state_sha256": "aaaaaaaaaaaaaaaaaaaaaaaaaaaaaaaaaaaaaaaaaaaaaaaaaaaaaaaaaaaaaaaa",
    "model_state_exact": true,
    "resumed_optimizer_state_sha256": "bbbbbbbbbbbbbbbbbbbbbbbbbbbbbbbbbbbbbbbbbbbbbbbbbbbbbbbbbbbbbbbb",
    "control_optimizer_state_sha256": "bbbbbbbbbbbbbbbbbbbbbbbbbbbbbbbbbbbbbbbbbbbbbbbbbbbbbbbbbbbbbbbb",
    "optimizer_state_exact": true,
    "resumed_scheduler_state_sha256": "cccccccccccccccccccccccccccccccccccccccccccccccccccccccccccccccc",
    "control_scheduler_state_sha256": "cccccccccccccccccccccccccccccccccccccccccccccccccccccccccccccccc",
    "scheduler_state_exact": true,
    "resumed_final_loss": 1.25,
    "control_final_loss": 1.25,
    "loss_absolute_delta": 0
  },
  "budget_ledger": {
    "declared_steps": 4,
    "source_steps": 2,
    "resume_segment_steps": 2,
    "resumed_cumulative_steps": 4,
    "control_steps": 4,
    "accounting": "exact",
    "double_charged": false
  },
  "limitations": [
    "Controlled synthetic engineering fixture only."
  ]
}
